{
  "schemaVersion": "2000m.v3.manifest.v1",
  "protocolVersion": "2000m.driver.v3",
  "language": "rust",
  "driver": {
    "command": "python3",
    "args": [
      "driver.py"
    ],
    "timeoutSeconds": 30
  },
  "assets": {
    "license": "no-assets",
    "attestation": "Missing-capture fixture used to prove visual rank blockers.",
    "sourceRefs": []
  },
  "notes": "Capture/playable intentionally absent; visual.ranked must remain false."
}
