{
  "schemaVersion": "2000m.v3.manifest.v1",
  "protocolVersion": "2000m.driver.v3",
  "language": "rust",
  "driver": {
    "command": "python3",
    "args": ["driver.py"],
    "timeoutSeconds": 1
  },
  "assets": {
    "license": "no-assets",
    "attestation": "Timeout regression fixture uses no assets.",
    "sourceRefs": []
  },
  "notes": "Driver intentionally sleeps longer than timeoutSeconds."
}
